,Start Date,Start Price,End Date,End Price,Weekly Returns,Bin Label,News,Basics
0,2023-01-08,205.72738647460938,2023-01-15,211.93043518066406,0.03015178879366287,U4,"[{""date"": ""20230109230011"", ""headline"": ""Honeywell International Inc. (HON) Gains As Market Dips: What You Should Know"", ""summary"": ""Honeywell International Inc. (HON) closed the most recent trading day at $210.67, moving +0.19% from the previous trading session.""}, {""date"": ""20230110130000"", ""headline"": ""HONEYWELL IDENTIFIES TOP BUILDING TECHNOLOGY TRENDS FOR 2023"", ""summary"": ""Honeywell (NASDAQ: HON) today released its predictions for emerging trends that will help shape building operations and technologies in 2023 and beyond. Top experts at Honeywell revealed insights on opportunities to make buildings more sustainable, safer and occupant focused.""}, {""date"": ""20230110140000"", ""headline"": ""HONEYWELL ANNOUNCES 2023 INVESTOR DAY EVENT IN NEW YORK CITY"", ""summary"": ""Honeywell (NASDAQ: HON) today announced that it will host its 2023 investor conference at the Nasdaq MarketSite in New York City on Thursday, May 11, 2023. The event will feature presentations and Q&A panels with the Honeywell leadership team. Further details will be provided closer to the event.""}, {""date"": ""20230111165900"", ""headline"": ""Honeywell International Inc. stock rises Wednesday, still underperforms market"", ""summary"": ""Shares of Honeywell International Inc. inched 0.45% higher to $212.30 Wednesday, on what proved to be an all-around positive trading session for the stock...""}, {""date"": ""20230112151603"", ""headline"": ""Top Stock Reports for Bristol-Myers Squibb, Honeywell International & Sony"", ""summary"": ""Today's Research Daily features new research reports on 16 major stocks, including Bristol-Myers Squibb Company (BMY), Honeywell International Inc. (HON) and Sony Group Corporation (SONY).""}, {""date"": ""20230112165900"", ""headline"": ""Honeywell International Inc. stock outperforms competitors on strong trading day"", ""summary"": ""Shares of Honeywell International Inc. rose 1.73% to $215.98 Thursday, on what proved to be an all-around great trading session for the stock market, with...""}, {""date"": ""20230113100010"", ""headline"": ""The Zacks Analyst Blog Highlights Bristol-Myers Squibb, Honeywell, Sony, Airbnb and Republic Services"", ""summary"": ""Bristol-Myers Squibb, Honeywell, Sony, Airbnb and Republic Services are included in this Analyst Blog.""}, {""date"": ""20230113144648"", ""headline"": ""PPA: Increased Defense Spending In Response To Ukraine War Is Supportive"", ""summary"": ""The United States finds itself in proxy wars with both Russia and China. Invesco Aerospace and Defense ETF should do well in this period. Read more on PPA ETF.""}, {""date"": ""20230113165900"", ""headline"": ""Honeywell International Inc. stock rises Friday, still underperforms market"", ""summary"": ""Shares of Honeywell International Inc. inched 0.29% higher to $216.61 Friday, on what proved to be an all-around positive trading session for the stock...""}, {""date"": ""20230113225010"", ""headline"": ""Honeywell International Inc. (HON) Gains But Lags Market: What You Should Know"", ""summary"": ""Honeywell International Inc. (HON) closed the most recent trading day at $216.61, moving +0.29% from the previous trading session.""}, {""date"": ""20230115235433"", ""headline"": ""Honeywell Is Poised For Acceleration, Or Is It?"", ""summary"": ""Honeywell International is now poised for accelerated growth and margin expansion. Find out why investors should adopt a wait-and-see approach on HON stock.""}]","{""assetTurnoverTTM"": 0.5716, ""bookValue"": 16697, ""cashRatio"": 0.48284682515798977, ""currentRatio"": 1.253, ""ebitPerShare"": 1.7563, ""eps"": 1.5052, ""ev"": 154022, ""fcfMargin"": 0.2313, ""fcfPerShareTTM"": 6.7485, ""grossMargin"": 0.3333, ""inventoryTurnoverTTM"": 4.4633, ""longtermDebtTotalAsset"": 0.2405, ""longtermDebtTotalCapital"": 0.413, ""longtermDebtTotalEquity"": 0.897, ""netDebtToTotalCapital"": 0.2742, ""netDebtToTotalEquity"": 0.5955, ""netMargin"": 0.1109, ""operatingMargin"": 0.1294, ""payoutRatioTTM"": 0.5475, ""pb"": 8.629, ""peTTM"": 29.0131, ""pfcfTTM"": 30.9515, ""pretaxMargin"": 0.1294, ""psTTM"": 4.0625, ""ptbv"": 10.6923, ""quickRatio"": 0.9752, ""receivablesTurnoverTTM"": 4.9707, ""roaTTM"": 0.08, ""roeTTM"": 0.2825, ""roicTTM"": 0.1367, ""rotcTTM"": 0.1756, ""salesPerShare"": 13.5687, ""sgaToSale"": 0.6667, ""tangibleBookValue"": 13475, ""totalDebtToEquity"": 1.1721, ""totalDebtToTotalAsset"": 0.3143, ""totalDebtToTotalCapital"": 0.5396, ""totalRatio"": 1.3663, ""period"": ""2022-12-31""}"
1,2023-01-15,211.93043518066406,2023-01-22,197.66539001464844,-0.0673100357381663,D5+,"[{""date"": ""20230115235433"", ""headline"": ""Honeywell Is Poised For Acceleration, Or Is It?"", ""summary"": ""Honeywell International is now poised for accelerated growth and margin expansion. Find out why investors should adopt a wait-and-see approach on HON stock.""}, {""date"": ""20230117083151"", ""headline"": ""Honeywell CEO: It's fairly unlikely that Europe will see an energy crunch this winter"", ""summary"": ""Honeywell CEO Darius Adamczyk joins CNBC's 'Squawk Box' to discuss his thoughts on the economy, if it's too soon to say this winter won't be a crunch, and more.""}, {""date"": ""20230117164004"", ""headline"": ""MARUY vs. HON: Which Stock Should Value Investors Buy Now?"", ""summary"": ""MARUY vs. HON: Which Stock Is the Better Value Option?""}, {""date"": ""20230117165900"", ""headline"": ""Honeywell International Inc. stock falls Tuesday, underperforms market"", ""summary"": ""Shares of Honeywell International Inc. slid 2.02% to $212.24 Tuesday, on what proved to be an all-around poor trading session for the stock market, with the...""}, {""date"": ""20230118140002"", ""headline"": ""Honeywell International Inc. (HON) is Attracting Investor Attention: Here is What You Should Know"", ""summary"": ""Honeywell International Inc. (HON) has been one of the stocks most watched by Zacks.com users lately. So, it is worth exploring what lies ahead for the stock.""}, {""date"": ""20230118164605"", ""headline"": ""Nicholas Ward's Dividend Growth Portfolio: December/Full Year 2022 Review"", ""summary"": ""My passive income was up by 46.50% on a year-over-year basis during December. For the full-year in 2022, my passive income rose by 23.73%. Click to read more.""}, {""date"": ""20230118191818"", ""headline"": ""FIDU: Industrials Dashboard For January"", ""summary"": ""Fidelity MSCI Industrials Index ETF is an interesting alternative to Industrial Select Sector SPDR ETF. Read more to see the comparison of FIDU and XLI.""}, {""date"": ""20230119203145"", ""headline"": ""Honeywell plans Plymouth campus expansion with new lab for weather-measurement devices"", ""summary"": ""Honeywell (NASDAQ: HON) plans to invest further in its Plymouth campus by constructing a new laboratory building on site.""}, {""date"": ""20230119230011"", ""headline"": ""Honeywell International Inc. (HON) Dips More Than Broader Markets: What You Should Know"", ""summary"": ""Honeywell International Inc. (HON) closed at $200.66 in the latest trading session, marking a -1.75% move from the prior day.""}, {""date"": ""20230121090000"", ""headline"": ""The Retiree's Dividend Portfolio, Jane's December Update: Index-Beating Year-End Results"", ""summary"": ""Jane's retirement accounts generated a total of $3,828.20 of dividend income for December 2022 vs. $2,580.62 of dividend income for December 2021. Read more here.""}, {""date"": ""20230122001500"", ""headline"": ""ClearBridge Appreciation Strategy Q4 2022 Portfolio Manager Commentary"", ""summary"": ""The ClearBridge Appreciation Strategy outperformed the benchmark S&P 500 Index in the fourth quarter of 2022. Click here to read the full fund letter.""}]","{""assetTurnoverTTM"": 0.5716, ""bookValue"": 16697, ""cashRatio"": 0.48284682515798977, ""currentRatio"": 1.253, ""ebitPerShare"": 1.7563, ""eps"": 1.5052, ""ev"": 154022, ""fcfMargin"": 0.2313, ""fcfPerShareTTM"": 6.7485, ""grossMargin"": 0.3333, ""inventoryTurnoverTTM"": 4.4633, ""longtermDebtTotalAsset"": 0.2405, ""longtermDebtTotalCapital"": 0.413, ""longtermDebtTotalEquity"": 0.897, ""netDebtToTotalCapital"": 0.2742, ""netDebtToTotalEquity"": 0.5955, ""netMargin"": 0.1109, ""operatingMargin"": 0.1294, ""payoutRatioTTM"": 0.5475, ""pb"": 8.629, ""peTTM"": 29.0131, ""pfcfTTM"": 30.9515, ""pretaxMargin"": 0.1294, ""psTTM"": 4.0625, ""ptbv"": 10.6923, ""quickRatio"": 0.9752, ""receivablesTurnoverTTM"": 4.9707, ""roaTTM"": 0.08, ""roeTTM"": 0.2825, ""roicTTM"": 0.1367, ""rotcTTM"": 0.1756, ""salesPerShare"": 13.5687, ""sgaToSale"": 0.6667, ""tangibleBookValue"": 13475, ""totalDebtToEquity"": 1.1721, ""totalDebtToTotalAsset"": 0.3143, ""totalDebtToTotalCapital"": 0.5396, ""totalRatio"": 1.3663, ""period"": ""2022-12-31""}"
2,2023-01-22,197.66539001464844,2023-01-29,203.63363647460938,0.030193684688648137,U4,"[{""date"": ""20230122001500"", ""headline"": ""ClearBridge Appreciation Strategy Q4 2022 Portfolio Manager Commentary"", ""summary"": ""The ClearBridge Appreciation Strategy outperformed the benchmark S&P 500 Index in the fourth quarter of 2022. Click here to read the full fund letter.""}, {""date"": ""20230123110000"", ""headline"": ""Honeywell: Buy The Drop On This Industrial Giant"", ""summary"": ""Honeywell has strong operating fundamentals and is seeing positive operating leverage through increasing margins. Read why I rate HON stock a buy.""}, {""date"": ""20230123225010"", ""headline"": ""Honeywell International Inc. (HON) Outpaces Stock Market Gains: What You Should Know"", ""summary"": ""Honeywell International Inc. (HON) closed the most recent trading day at $204.46, moving +1.2% from the previous trading session.""}, {""date"": ""20230124022625"", ""headline"": ""3 Quantum Computing Stocks to Buy Now OR You\u2019ll Be Kicking Yourself Later"", ""summary"": ""Quantum computing is expected to revolutionize how computers process data. Accordingly, many investors are looking to capitalize on this potential, with quantum computing stocks seen as an increasingly attractive investment option. The market potential of quantum computing is immense, given the fact that quantum computers can tackle complex problems exponentially faster than ever before. Currently, experts estimate quantum computing has the potential to grow to an estimated $90 billion sector in""}, {""date"": ""20230125192505"", ""headline"": ""Cramer's lightning round: I like Nucor over Cleveland-Cliffs"", ""summary"": ""\""Mad Money\"" host Jim Cramer rings the lightning round bell, which means he's giving his answers to callers' stock questions at rapid speed.""}, {""date"": ""20230125213033"", ""headline"": ""Dividend Growth Checkup - 2022"", ""summary"": ""Dividend growth pulled back some versus 2021; however, it was still a strong year of dividend growth. Learn more about my dividend growth for 2022.""}, {""date"": ""20230126150003"", ""headline"": ""Will Supply-Chain & Cost Woes Mar Honeywell (HON) Q4 Earnings?"", ""summary"": ""Supply-chain disruptions and raw material cost inflation are likely to have hurt Honeywell's (HON) Q4 earnings. Pricing actions are expected to have partly offset the adversity.""}, {""date"": ""20230126150103"", ""headline"": ""Honeywell International Inc. (HON) Earnings Expected to Grow: What to Know Ahead of Next Week's Release"", ""summary"": ""Honeywell International Inc. (HON) doesn't possess the right combination of the two key ingredients for a likely earnings beat in its upcoming report. Get prepared with the key expectations.""}, {""date"": ""20230127140014"", ""headline"": ""Rockwell Automation Seems To Be Handling This Short-Cycle Air Pocket Well"", ""summary"": ""Rockwell's better-than-expected results and healthy end-market guidance should improve sentiment on industrials. Click here to read my analysis of ROK stock.""}, {""date"": ""20230129110457"", ""headline"": ""GAB: Despite 15% Price Loss, This High-Yielding CEF Isn't Undervalued"", ""summary"": ""Despite a price loss of more than 15 percent during the past 12 months, GAB is still trading at a price multiple that is at par to its peers. Read more here.""}]",{}
