,Start Date,Start Price,End Date,End Price,Weekly Returns,Bin Label,News,Basics
5,2023-02-12,196.1391143798828,2023-02-19,197.06858825683594,0.004738850177292697,U1,"[{""date"": ""20230212124000"", ""headline"": ""3 Cathie Wood Growth Stocks to Buy and Hold for the Long Term"", ""summary"": ""An alternative to trying to time the market (which even famed investor Warren Buffett says he can't do) is to buy high-quality growth companies with long-term growth prospects at any point in time and hold on to the stock long-term.  In that vein of thought, here are three growth stocks purchased by another famed investor, Cathie Wood of Ark Invest, through her investment firm's various Ark funds.  There is a conglomerate stock in the ARK Space Exploration & Innovation ETF (NYSEMKT: ARKX) that has an intriguing mix of near-, medium-, and long-term growth prospects.""}, {""date"": ""20230213140000"", ""headline"": ""HONEYWELL TO HOST LEADERSHIP WEBCAST FOR INVESTORS ON DECARBONIZATION"", ""summary"": ""Honeywell (NASDAQ: HON) today announced that the next installment of its live leadership webcast series for investors will feature a conversation with Honeywell's Anne Madden, senior vice president and general counsel, Suresh Venkatarayalu, senior vice president and chief technology and innovation officer, Evan van Hook, chief sustainability officer, and Gavin Towler, chief technology officer of Performance Materials and Technologies. The discussion will be hosted by Bank of America's Savita Sub""}, {""date"": ""20230213165900"", ""headline"": ""Honeywell International Inc. stock outperforms market on strong trading day"", ""summary"": ""Shares of Honeywell International Inc. rallied 1.45% to $203.37 Monday, on what proved to be an all-around great trading session for the stock market, with...""}, {""date"": ""20230214035000"", ""headline"": ""Honeywell price target raised to $205 from $190 at HSBC"", ""summary"": ""Looking for stock market analysis and research with proves results? Zacks.com offers in-depth financial research with over 30years of proven results.""}, {""date"": ""20230214100100"", ""headline"": ""Top 5 4th Quarter Trades of Compagnie Lombard Odier SCmA"", ""summary"": ""Looking for stock market analysis and research with proves results? Zacks.com offers in-depth financial research with over 30years of proven results.""}, {""date"": ""20230214100100"", ""headline"": ""Eos Management, L.P. Goes on Buying Spree in 4th Quarter"", ""summary"": ""Looking for stock market analysis and research with proves results? Zacks.com offers in-depth financial research with over 30years of proven results.""}, {""date"": ""20230214165900"", ""headline"": ""Honeywell International Inc. stock falls Tuesday, underperforms market"", ""summary"": ""Shares of Honeywell International Inc. shed 1.17% to $201.00 Tuesday, on what proved to be an all-around grim trading session for the stock market, with the...""}, {""date"": ""20230214205200"", ""headline"": ""Honeywell\u2019s Quantum-Computing Business Names a New Leader"", ""summary"": ""Quantinuum, the quantum-computing business formed by Honeywell and Cambridge Quantum, has a new CEO.""}, {""date"": ""20230215011200"", ""headline"": ""Watchdog warns over UK police use of China-made surveillance equipment"", ""summary"": ""Looking for stock market analysis and research with proves results? Zacks.com offers in-depth financial research with over 30years of proven results.""}, {""date"": ""20230215085100"", ""headline"": ""Dow`s 150-point drop led by losses in Chevron, Intel stocks"", ""summary"": ""Looking for stock market analysis and research with proves results? Zacks.com offers in-depth financial research with over 30years of proven results.""}, {""date"": ""20230215120100"", ""headline"": ""Top 5 4th Quarter Trades of MAR VISTA INVESTMENT PARTNERS LLC"", ""summary"": ""Looking for stock market analysis and research with proves results? Zacks.com offers in-depth financial research with over 30years of proven results.""}, {""date"": ""20230215130547"", ""headline"": ""Exxon to use Honeywell carbon capture tech at hydrogen facility"", ""summary"": ""Exxon Mobil Corp will use technology from Honeywell International Inc to capture carbon dioxide at a proposed hydrogen production facility in Texas, Honeywell said.  Honeywell said the technology would enable Exxon to capture about 7 million tons of carbon dioxide (CO2) per year, equivalent to emissions from 1.5 million automobiles for one year, Honeywell said.""}, {""date"": ""20230215165900"", ""headline"": ""Honeywell International Inc. stock underperforms Wednesday when compared to competitors despite daily gains"", ""summary"": ""Shares of Honeywell International Inc. inched 0.35% higher to $201.71 Wednesday, on what proved to be an all-around positive trading session for the stock...""}, {""date"": ""20230215211832"", ""headline"": ""Exxon to use Honeywell's carbon capture tech in Baytown hydrogen production project"", ""summary"": ""Honeywell's technology is expected to enable Exxon to capture around 7 million tons of CO2 per year.""}, {""date"": ""20230216165900"", ""headline"": ""Honeywell International Inc. stock underperforms Thursday when compared to competitors"", ""summary"": ""Shares of Honeywell International Inc. shed 1.17% to $199.36 Thursday, on what proved to be an all-around poor trading session for the stock market, with the...""}, {""date"": ""20230217020200"", ""headline"": ""Catalyst watch: Spotlight on retail earnings, Lucid Group, Silvergate Capital and Radware"", ""summary"": ""Looking for stock market analysis and research with proves results? Zacks.com offers in-depth financial research with over 30years of proven results.""}, {""date"": ""20230217044528"", ""headline"": ""S&W Seed Posts A Better Quarter And Signs A Promising Biofuel Agreement"", ""summary"": ""S&W remains a promising, but highly risky, opportunity in agri-tech on the potential of its Double Team sorghum and ventures in biofuels and stevia. Find out SANW stock is a Hold.""}, {""date"": ""20230217060400"", ""headline"": ""3 Stocks to Buy for the Future of Smart Homes"", ""summary"": ""Looking for stock market analysis and research with proves results? Zacks.com offers in-depth financial research with over 30years of proven results.""}, {""date"": ""20230217110600"", ""headline"": ""AdvanSix - Muddling Through"", ""summary"": ""Looking for stock market analysis and research with proves results? Zacks.com offers in-depth financial research with over 30years of proven results.""}, {""date"": ""20230217111500"", ""headline"": ""3 Clean Energy Dividend Stocks That Are Passive Income Powerhouses"", ""summary"": ""These quality companies are worthy of being foundational holdings in an income-orientated portfolio.""}, {""date"": ""20230217123700"", ""headline"": ""I \ufffd\ufffd\ufffdTricked` ChatGPT Into Picking Stocks to Buy. Here`s What It Said."", ""summary"": ""Looking for stock market analysis and research with proves results? Zacks.com offers in-depth financial research with over 30years of proven results.""}, {""date"": ""20230217165900"", ""headline"": ""Honeywell International Inc. stock rises Friday, outperforms market"", ""summary"": ""Shares of Honeywell International Inc. rose 1.03% to $201.42 Friday, on what proved to be an all-around mixed trading session for the stock market, with the...""}, {""date"": ""20230218073445"", ""headline"": ""JEPI: 2 Better Long-Term Big Yields"", ""summary"": ""If you love income and hate volatility, JEPI is hard to ignore. But if you want to maximize long-term income and total returns, JEPI should be totally avoided. Read more here.""}, {""date"": ""20230218080000"", ""headline"": ""VIS: Industrials Dashboard For February"", ""summary"": ""Transportation still looks attractive regarding value and quality scores. Here we discuss Vanguard Industrials ETF, or VIS, an alternative to XLI.""}, {""date"": ""20230219021352"", ""headline"": ""Dividend Champion, Contender, And Challenger Highlights: Week Of February 19"", ""summary"": ""Weekly summary of dividend activity for Dividend Champions, Contenders, Challengers. Read more to see the companies with upcoming ex-dividend dates.""}, {""date"": ""20230219122000"", ""headline"": ""Longtime Honeywell CEO Backs This Supercharged Growth Stock: Is It a Buy?"", ""summary"": ""Industrial tech company Vertiv has a legendary executive and a highly regarded activist investor supporting its turnaround.""}]",{}
6,2023-02-19,197.06858825683594,2023-02-26,188.8864288330078,-0.0415193486501485,D5,"[{""date"": ""20230219021352"", ""headline"": ""Dividend Champion, Contender, And Challenger Highlights: Week Of February 19"", ""summary"": ""Weekly summary of dividend activity for Dividend Champions, Contenders, Challengers. Read more to see the companies with upcoming ex-dividend dates.""}, {""date"": ""20230219122000"", ""headline"": ""Longtime Honeywell CEO Backs This Supercharged Growth Stock: Is It a Buy?"", ""summary"": ""Industrial tech company Vertiv has a legendary executive and a highly regarded activist investor supporting its turnaround.""}, {""date"": ""20230220153456"", ""headline"": ""25 Most Profitable NASDAQ Stocks Today"", ""summary"": ""In this article, we will look at the 25 most profitable NASDAQ stocks today. If you want to explore similar stocks, you can also take a look at 10 Most Profitable NASDAQ Stocks Today. 2022 was one of the worst years for the NASDAQ, primarily because it is dominated by tech, and tech stocks crashed as [\u2026]""}, {""date"": ""20230220164004"", ""headline"": ""MARUY or HON: Which Is the Better Value Stock Right Now?"", ""summary"": ""MARUY vs. HON: Which Stock Is the Better Value Option?""}, {""date"": ""20230221034200"", ""headline"": ""Berkshire Hathaway Inc. Cl B stock outperforms market despite losses on the day"", ""summary"": ""Looking for stock market analysis and research with proves results? Zacks.com offers in-depth financial research with over 30years of proven results.""}, {""date"": ""20230221074900"", ""headline"": ""United Airlines attracts major partners for sustainable aviation fuel technology fund"", ""summary"": ""Looking for stock market analysis and research with proves results? Zacks.com offers in-depth financial research with over 30years of proven results.""}, {""date"": ""20230221080001"", ""headline"": ""United Airlines, five other companies launch effort to develop sustainable aviation fuel"", ""summary"": ""The United Airlines Ventures Sustainable Flight Fund will start with money invested from Air Canada, Boeing, GE Aerospace, JPMorgan Chase and Honeywell. ""}, {""date"": ""20230221082700"", ""headline"": ""United Airlines Launches Venture Fund Targeting Sustainable Aviation Fuel >UAL"", ""summary"": ""By Colin Kellaher United Airlines Holdings Inc. on Tuesday said it its United Airlines Ventures arm has launched the Sustainable Flight Fund, an investment...""}, {""date"": ""20230221085800"", ""headline"": ""Ex-Dividend Reminder: Honeywell International, Thomson Reuters Corp and Marriott International"", ""summary"": ""Looking for stock market analysis and research with proves results? Zacks.com offers in-depth financial research with over 30years of proven results.""}, {""date"": ""20230221130000"", ""headline"": ""United Airlines Creates Fund for Sustainable Aviation Fuel"", ""summary"": ""United Airlines Holdings  is launching a fund backed by several big-name aerospace and financial companies to invest in startups aiming to produce sustainable aviation fuel, in one of the largest efforts yet to lower emissions from air travel.  Created through United\u2019s venture investing arm, the new fund will start with more than $100 million from the company and partners including  Air Canada Boeing  ,  JPMorgan Chase  & Co.,  Honeywell International  and  General Electric  , United said Tuesday.  Last year\u2019s climate law spurred United to accelerate the fund, which will be capped at $500 million, the company said.""}, {""date"": ""20230221163201"", ""headline"": ""Cognex Struggling To Deliver As Logistics Spending Shrinks"", ""summary"": ""Cognex is struggling with a sharp decline in warehouse automation spending at Amazon. Click here to read my analysis of CGNX stock.""}, {""date"": ""20230221165900"", ""headline"": ""Honeywell International Inc. stock underperforms Tuesday when compared to competitors"", ""summary"": ""Shares of Honeywell International Inc. slipped 2.31% to $196.76 Tuesday, on what proved to be an all-around poor trading session for the stock market, with...""}, {""date"": ""20230221235435"", ""headline"": ""Unusual Put Option Trade in Honeywell International (HON)  Worth $1,720.00K"", ""summary"": """"}, {""date"": ""20230222083741"", ""headline"": ""The United Airlines SAF Technology Investment Hype: A Drop In The Ocean"", ""summary"": ""United Airlines can benefit from a strong demand cycle for air travel. Click here to find out why UAL stock is a Buy.""}, {""date"": ""20230222125110"", ""headline"": ""Honeywell International (HON) presents at Barclays Industrial Select Conference - Slideshow"", ""summary"": ""The following slide deck was published by Honeywell International Inc.""}, {""date"": ""20230222130000"", ""headline"": ""HONEYWELL SURVEY REVEALS INCREASED EXPECTATIONS FOR HEALTHIER WORKPLACES"", ""summary"": ""The findings of Honeywell's (NASDAQ: HON) third annual Healthy Buildings Survey helped shed light on the impact of buildings on both occupant well-being and the planet. More than two in five (43%) surveyed office workers are very or extremely worried about their building's indoor air quality (IAQ), according to the report released today. The survey recently queried 2,500 office workers in buildings with 500-plus workers in Germany, India, the Middle East, the United Kingdom and the United States""}, {""date"": ""20230222140002"", ""headline"": ""Honeywell International Inc. (HON) is Attracting Investor Attention: Here is What You Should Know"", ""summary"": ""Honeywell International Inc. (HON) has received quite a bit of attention from Zacks.com users lately. Therefore, it is wise to be aware of the facts that can impact the stock's prospects.""}, {""date"": ""20230222152854"", ""headline"": ""MSA Safety Delivering Well On Less Cyclical Opportunities"", ""summary"": ""MSA Safety had a better than expected fourth quarter, with good sales execution on healthy underlying demand. Click here to see our take on MSA stock.""}, {""date"": ""20230222165900"", ""headline"": ""Honeywell International Inc. stock underperforms Wednesday when compared to competitors"", ""summary"": ""Shares of Honeywell International Inc. slid 0.65% to $195.49 Wednesday, on what proved to be an all-around grim trading session for the stock market, with...""}, {""date"": ""20230223013700"", ""headline"": ""Nicholas Ward`s Dividend Growth Portfolio: January 2023 Review"", ""summary"": ""Looking for stock market analysis and research with proves results? Zacks.com offers in-depth financial research with over 30years of proven results.""}, {""date"": ""20230223014700"", ""headline"": ""The Top 7 Growth Stocks in the Booming Battery Industry"", ""summary"": ""Looking for stock market analysis and research with proves results? Zacks.com offers in-depth financial research with over 30years of proven results.""}, {""date"": ""20230223023503"", ""headline"": ""Nicholas Ward's Dividend Growth Portfolio: January 2023 Review"", ""summary"": ""My dividend income rose by 9.56% on a y/y basis during January. My portfolio's value rose by approximately 6.9%. Here's a review of my portfolio for January 2023.""}, {""date"": ""20230223165900"", ""headline"": ""Honeywell International Inc. stock rises Thursday, still underperforms market"", ""summary"": ""Shares of Honeywell International Inc. inched 0.29% higher to $195.02 Thursday, on what proved to be an all-around great trading session for the stock...""}, {""date"": ""20230224165900"", ""headline"": ""Honeywell International Inc. stock falls Friday, underperforms market"", ""summary"": ""Shares of Honeywell International Inc. slipped 1.53% to $192.04 Friday, on what proved to be an all-around rough trading session for the stock market, with...""}, {""date"": ""20230225080500"", ""headline"": ""The Retiree`s Dividend Portfolio, Jane`s December Update: 2023 Dividend Projections"", ""summary"": ""Looking for stock market analysis and research with proves results? Zacks.com offers in-depth financial research with over 30years of proven results.""}, {""date"": ""20230225090000"", ""headline"": ""The Retiree's Dividend Portfolio, Jane's December Update: 2023 Dividend Projections"", ""summary"": ""Jane's retirement accounts generated a total of $2,506.30 of dividend income for January 2023 vs. $2,258.71 of dividend income for January 2022. Read more here.""}, {""date"": ""20230225123300"", ""headline"": ""Honeywell International Inc. (HON) Presents at Citi`s 2023 Global Industrial Tech and Mobility Conference (Transcript)"", ""summary"": ""Looking for stock market analysis and research with proves results? Zacks.com offers in-depth financial research with over 30years of proven results.""}, {""date"": ""20230225132906"", ""headline"": ""Honeywell International Inc. (HON) Presents at Citi's 2023 Global Industrial Tech and Mobility Conference (Transcript)"", ""summary"": ""Honeywell International Inc. (NASDAQ:NASDAQ:HON) Citi\u00e2\u0080\u0099s 2023 Global Industrial Tech and Mobility Conference February 21, 2023 8:00 AM ETCompany ParticipantsGreg Lewis - SVP and...""}, {""date"": ""20230225195602"", ""headline"": ""Honeywell International Inc. (HON) Presents at Barclays Industrial Select Conference (Transcript)"", ""summary"": ""Honeywell International Inc. (NASDAQ:NASDAQ:HON) Barclays Industrial Select Conference February 22, 2023 8:00 AM ETCompany ParticipantsGreg Lewis - CFOConference Call ParticipantsJulian...""}, {""date"": ""20230226122300"", ""headline"": ""Brady: Self-Help Vs. A More Challenging Macro Environment"", ""summary"": ""Looking for stock market analysis and research with proves results? Zacks.com offers in-depth financial research with over 30years of proven results.""}]",{}
7,2023-02-26,188.8864288330078,2023-03-05,193.58795166015625,0.02489073913989337,U3,"[{""date"": ""20230226122300"", ""headline"": ""Brady: Self-Help Vs. A More Challenging Macro Environment"", ""summary"": ""Looking for stock market analysis and research with proves results? Zacks.com offers in-depth financial research with over 30years of proven results.""}, {""date"": ""20230227165900"", ""headline"": ""Honeywell International Inc. stock rises Monday, still underperforms market"", ""summary"": ""Shares of Honeywell International Inc. inched 0.21% higher to $192.45 Monday, on what proved to be an all-around positive trading session for the stock...""}, {""date"": ""20230228040400"", ""headline"": ""The 20 worst U.S. stocks in February: the biggest loser dropped 35%"", ""summary"": ""Looking for stock market analysis and research with proves results? Zacks.com offers in-depth financial research with over 30years of proven results.""}, {""date"": ""20230228072000"", ""headline"": ""Honeywell price target lowered to $185 from $193 at UBS"", ""summary"": ""Looking for stock market analysis and research with proves results? Zacks.com offers in-depth financial research with over 30years of proven results.""}, {""date"": ""20230228102002"", ""headline"": ""Honeywell Lagging A Bit Despite Consistent Performance"", ""summary"": ""Honeywell's Q4 results were largely typical of the larger industrial sector and basically in-line with expectations. See why we believe HON stock is a buy.""}, {""date"": ""20230228140000"", ""headline"": ""HONEYWELL ANNOUNCES PARTICIPATION AT UPCOMING INVESTOR CONFERENCES"", ""summary"": ""Honeywell (NASDAQ: HON) today announced its participation at upcoming investor conferences in March.""}, {""date"": ""20230228170200"", ""headline"": ""Honeywell International Inc. stock underperforms Tuesday when compared to competitors"", ""summary"": ""Shares of Honeywell International Inc. dropped 0.50% to $191.48 Tuesday, on what proved to be an all-around dismal trading session for the stock market, with...""}, {""date"": ""20230301071500"", ""headline"": ""Tracking Mario Gabelli`s Gabelli Funds 13F Portfolio - Q4 2022 Update"", ""summary"": ""Looking for stock market analysis and research with proves results? Zacks.com offers in-depth financial research with over 30years of proven results.""}, {""date"": ""20230301151526"", ""headline"": ""Eaton Continues To Leverage Some Of The Best End-Market Opportunities In The Industrial Space"", ""summary"": ""Eaton's fourth quarter results were in line with expectations. Click here to read what sectors are helping Eaton grow and our take on ETN stock.""}, {""date"": ""20230301165900"", ""headline"": ""Honeywell International Inc. stock rises Wednesday, outperforms market"", ""summary"": ""Shares of Honeywell International Inc. inched 0.73% higher to $192.88 Wednesday, on what proved to be an all-around mixed trading session for the stock...""}, {""date"": ""20230301201444"", ""headline"": ""Tracking Mario Gabelli's Gabelli Funds 13F Portfolio - Q4 2022 Update"", ""summary"": ""Gabelli Funds\u00e2\u0080\u0099 13F portfolio value increased from $12.13B to $12.87B this quarter. Click here to read more about its holdings and trades for Q4 2022.""}, {""date"": ""20230302003000"", ""headline"": ""Barron\u2019s 100 Most Sustainable U.S. Companies"", ""summary"": ""Amid a backlash against ESG, many companies are forging ahead with plans for a \u201ccircular economy\u201d to cut waste and pollution. Here\u2019s how some of the most...""}, {""date"": ""20230302024100"", ""headline"": ""The Only 7 Battery Stocks That Matter"", ""summary"": ""Looking for stock market analysis and research with proves results? Zacks.com offers in-depth financial research with over 30years of proven results.""}, {""date"": ""20230302100800"", ""headline"": ""June 2024 Options Now Available For Honeywell International (HON)"", ""summary"": ""Looking for stock market analysis and research with proves results? Zacks.com offers in-depth financial research with over 30years of proven results.""}, {""date"": ""20230302130000"", ""headline"": ""HUDSON COUNTY ENGAGES HONEYWELL TO HELP DEVELOP AND IMPLEMENT A SMART COMMUNITY PROGRAM"", ""summary"": ""Hudson County, N.J., today announced it is working with Honeywell (Nasdaq: HON) on the development and implementation of a smart community strategic plan. The project aims to help increase resident engagement, strengthen community resilience, reduce energy consumption, improve public safety and help ease traffic congestion and improve mobility, including safety.""}, {""date"": ""20230302165900"", ""headline"": ""Honeywell International Inc. stock rises Thursday, outperforms market"", ""summary"": ""Shares of Honeywell International Inc. inched 0.81% higher to $194.45 Thursday, on what proved to be an all-around positive trading session for the stock...""}, {""date"": ""20230303040900"", ""headline"": ""Boeing leads weekly gains in industrial stocks as markets end losing streaks"", ""summary"": ""Looking for stock market analysis and research with proves results? Zacks.com offers in-depth financial research with over 30years of proven results.""}, {""date"": ""20230303165900"", ""headline"": ""Honeywell International Inc. stock rises Friday, still underperforms market"", ""summary"": ""Shares of Honeywell International Inc. advanced 1.22% to $196.82 Friday, on what proved to be an all-around favorable trading session for the stock market,...""}, {""date"": ""20230304122841"", ""headline"": ""15 Large-Cap Stocks Hedge Funds Are Dumping"", ""summary"": ""In this article, we will look at the 15 large-cap stocks hedge funds are dumping. If you want to explore similar stocks, you can also take a look at 5 Large-Cap Stocks Hedge Funds Are Dumping. We are now approaching the end of the first quarter of 2023 and the markets are exhibiting an upward [\u2026]""}, {""date"": ""20230305001534"", ""headline"": ""Dividend Champion, Contender, And Challenger Highlights: Week Of March 5"", ""summary"": ""A weekly summary of dividend activity for Dividend Champions, Contenders, and Challengers. Read more to see the companies with upcoming ex-dividend dates.""}]",{}
